,title,originallink,link,description,pubDate
94,"윤도현, '희귀암 투병' 중에도 라디오+뮤지컬..&quot;방사선 치료 후 힘없어...",http://www.osen.co.kr/article/G1112528854,https://m.entertain.naver.com/article/109/0005266538,"교과서에도 실릴 만큼 대히트를 친 YB의 명곡이자 박태희가 작사, 작곡한 ‘<b>나는 나비</b>’의 눈물겨운 비하인드 스토리도 공개됐다. 특히 멤버들의 거센 반대가 있었음에도 박태희가 밀어붙여 결국 초대박이 나 윤도현의... ","Sun, 23 Mar 2025 08:35:00 +0900"
95,"'보고싶었어' 윤도현, 신해철과 찡한 인연→희귀암 극복기",https://www.slist.kr/news/articleView.html?idxno=628912,https://www.slist.kr/news/articleView.html?idxno=628912,"대히트를 친 YB의 명곡이자 박태희가 작사, 작곡한 '<b>나는 나비</b>'의 눈물겨운 비하인드 스토리도 공개됐다. 특히 멤버들의 거센 반대가 있었음에도 박태희가 밀어붙여 결국 초대박이 나 윤도현의 자작곡 200개와 견줄 수... ","Sun, 23 Mar 2025 08:14:00 +0900"
96,"‘희귀암 투병’ 윤도현 “아픈몸 이끌고 라디오, 방사선 치료받고 힘없...",https://www.newsen.com/news_view.php?uid=202503230759410410,https://m.entertain.naver.com/article/609/0000966650,"교과서에도 실릴 만큼 대히트를 친 YB의 명곡이자 박태희가 작사, 작곡한 ‘<b>나는 나비</b>’의 눈물겨운 비하인드 스토리도 공개됐다. 특히 멤버들의 거센 반대가 있었음에도 박태희가 밀어붙여 결국 초대박이 나 윤도현의... ","Sun, 23 Mar 2025 08:03:00 +0900"
97,"'최화정 김호영의 보고싶었어' YB 윤도현, 히트곡 뒷이야기 대공개! &quot;내...",https://www.cbci.co.kr/news/articleView.html?idxno=491992,https://www.cbci.co.kr/news/articleView.html?idxno=491992,"YB의 명곡 '<b>나는 나비</b>'와 얽힌 이야기도 공개된다. 박태희가 작사, 작곡한 이 곡은 멤버 전원이 처음에는 큰... 윤도현은 '<b>나는 나비</b>'의 저작권료가 자신의 자작곡 200개와 합친 금액과 비슷하다고 말해 놀라움을 안긴다.... ","Sat, 22 Mar 2025 21:40:00 +0900"
98,땅끝마을 해남 매화꽃향기 따라 봄 오다 [최현태 기자의 여행홀릭],http://www.segye.com/newsView/20250322500705?OutUrl=naver,https://n.news.naver.com/mnews/article/022/0004021132?sid=103,모질게 춥던 겨울 잘 버틴 나무 가지마다 엄지손톱만큼 작고 하얀 꽃 나른한 기지개 켜며 <b>나</b> 좀 봐달라고... 후박나무 군락지를 보존한 <b>나비</b>의 숲에는 청띠제비<b>나비</b>가 산다. 이곳은 치유와 명상의 시간을 갖는 공간.... ,"Sat, 22 Mar 2025 07:20:00 +0900"
99,"'55세' YB 박태희, 서울 자가 마련했다…윤도현 &quot;내 자작곡 200개 합친 수...",https://tenasia.hankyung.com/article/2025032188364,https://m.entertain.naver.com/article/312/0000705135,"세상의 빛을 못 볼 뻔한 명실상부 YB 대히트곡 '<b>나는 나비</b>'와 얽힌 에피소드도 털어놓는다. 박태희가 작사, 작곡한 이 곡은 처음에는 멤버 전원의 반응이 시큰둥했다고. 박태희는 '<b>나는 나비</b>' 성공 후 서울에 집은 물론... ","Fri, 21 Mar 2025 19:31:00 +0900"
