,title,originallink,link,description,pubDate
0,"8시간 20분의 비행, 인도양의 진주 스리랑카에 들다",http://www.incheonin.com/news/articleView.html?idxno=108670,http://www.incheonin.com/news/articleView.html?idxno=108670,스리랑카 지폐에는 새와 <b>나비</b> 그림이 들어있다. 자연을 중히 여기는 나라라는 생각이 들었다. 거대한 불상이 맞아주는 공항을 나와 버스를 타고 숙소가 있는 스리랑카의 서부 해안 도시 네곰보로 이동했다. 스리랑카... ,"Fri, 04 Apr 2025 18:02:00 +0900"
1,"&quot;봄이 왔다 VS 멸망 시작&quot;…연예계, 탄핵 인용 반응들",http://www.dispatch.co.kr/2321074,https://m.entertain.naver.com/article/433/0000115121,"나도 살고, 나라도 산 <b>날</b>&quot;이라며 &quot;대한민국 만세&quot;를 외쳤다. 변영주 감독은 SNS에 '윤석열 파면' 자막을... &quot;내란<b>나비</b>, 때려잡을 일만 남았다&quot;는 댓글에 &quot;잡아라. 누구 맘대로&quot;라고 응수했다. 차강석은 탄핵 반대론자들을... ","Fri, 04 Apr 2025 17:25:00 +0900"
2,봄이 왔도다,http://www.siminsori.com/news/articleView.html?idxno=287538,http://www.siminsori.com/news/articleView.html?idxno=287538,"마치 오케스트라 지휘자가 지휘봉을 흔들면 서로 다른 악기들이 조화를 이루듯, 꽃과 <b>나비</b>, 새와 풀이... 숲으로 <b>난</b> 소롯길을 오르내리며 <b>나는</b> 봄기운이 몸을 감싸는 것을 느꼈다. 날더러 봄의 나라로 초대하는 듯했다.... ","Fri, 04 Apr 2025 15:28:00 +0900"
3,"인천시교육청부평도서관, 영유아 및 초등 1, 2학년 대상 '북스타트 책꾸...",https://www.lecturernews.com/news/articleView.html?idxno=175596,https://www.lecturernews.com/news/articleView.html?idxno=175596,"선정도서는 1단계(0~8개월) '동글동글 동그라미', '햇살이와 <b>나비</b>', 2단계(19~35개월) '타세요, 타!', '<b>나는</b> 컵이 아니야!', 3단계(36개월~취학전) '감자 감자 뿅', '어떻게 추는 거야?', 4단계(초등1~2학년) '어느 <b>날</b>', '김밥의 탄생... ","Fri, 04 Apr 2025 11:50:00 +0900"
4,"[여행을 떠나요] 사랑을 새기고, 기억과 함께 걷는 제주 2박 3일 여행",https://www.newscj.com/news/articleView.html?idxno=3253932,https://www.newscj.com/news/articleView.html?idxno=3253932,"또한, 장수풍뎅이, 호랑<b>나비</b>, 사슴벌레 등 다양한 곤충을 관찰하며 학습할 수 있는 체험도 흥미롭다. 건강을 챙길 수 있는 발지압 체험과 전통 놀이인 굴렁쇠 굴리기, 투호 던지기, 돌탑 쌓기 등도 제공되어 방문객들에게... ","Fri, 04 Apr 2025 10:00:00 +0900"
5,[현대어로 읽는 청오 차상찬] 16.우이동의 벚꽃- 벚꽃의 할아버지는 조...,http://www.kado.net/news/articleView.html?idxno=1302914,https://n.news.naver.com/mnews/article/654/0000114307?sid=102,"왜성대의 사쿠라가 아직 콧물을 졸졸 흘리고, 창경원 사쿠라가 펄펄 <b>나는 나비</b>들에게 그 첫 향기를 맛볼 만한 시기에 도달하기 전인, 십여 년 전만 하더라도 경성 근처에서 앵화 명소라면 으레 우이동을 첫손가락에... ","Fri, 04 Apr 2025 00:05:00 +0900"
6,[역사속 오늘·4.4·청명·정신건강의 <b>날</b>] 한미수호통상조약(1882)·바둑 ...,http://kor.theasian.asia/archives/379880,http://kor.theasian.asia/archives/379880,4(금) 음력 3.7 계묘·청명·사사(辭寫)데이·종이 안 쓰는 <b>날</b>·정신건강의 <b>날</b>·향토예비군의 <b>날</b>(4월 첫째... 있다...<b>나비</b> 한 마리 방금 꽃 한 송이를 스쳐가듯/스쳐 가는 것/오늘 <b>나는</b> 누구를 스쳐가는가/스침은... ,"Thu, 03 Apr 2025 22:22:00 +0900"
7,인천 동네책방에 ‘신바람 책담회’ 9월24일까지 불어온다,https://www.kyeongin.com/article/1734884,https://www.kyeongin.com/article/1734884,"한미서점, <b>나비</b>날다책방, 나즌문턱, 책방모도다. 한국근대문학관은 지난해부터 신바람 동네책방 책담회를 이어오고 있다. 지난해 지역 서점 21곳에서 54차례 운영했으며, 700명 이상이 참여했다. 올해 참여 서점은... ","Thu, 03 Apr 2025 18:50:00 +0900"
8,[인터뷰] 내가 사랑하는 영화들 – 배우 이준혁의 영화관(觀) ②,http://www.cine21.com/news/view/?mag_id=107249&utm_source=naver&utm_medium=news,https://m.entertain.naver.com/article/140/0000054888,넬리(마고 로비)가 촬영장에서 겪는 좌충우돌이나 촬영장에 <b>나비</b>가 날아드는 장면에 충격에 가까운 감동을... &lt;파벨만스&gt;는 보고 <b>난</b> 직후보다 시간이 한참 지나고 내 안에 은은하게 자리 잡았다. 영화 팬의 정체성과... ,"Thu, 03 Apr 2025 18:16:00 +0900"
9,[인터뷰] 내가 사랑하는 영화들 – 배우 이준혁의 영화관(觀) ①,http://www.cine21.com/news/view/?mag_id=107248&utm_source=naver&utm_medium=news,https://m.entertain.naver.com/article/140/0000054887,"많이들 내 이름 앞의 직업인 연기자를 먼저 보고, <b>나</b> 역시 직업의 특수성을 앞세워 수많은 사람을 만난다.... 그래서 &lt;바빌론&gt;에서 완벽과 거리가 먼 촬영 현장에 <b>나비</b>가 날아들어 방점을 찍는 장면에서 펑펑 울었다.","Thu, 03 Apr 2025 18:16:00 +0900"
10,[공감] 개미의 숙제,https://www.busan.com/view/busan/view.php?code=2025040317480731804,https://n.news.naver.com/mnews/article/082/0001319515?sid=110,"‘담흑부전<b>나비</b>’라는 <b>나비</b>가 있다. 이놈은 일본왕개미가 다니는 길목에 알을 놓는다. 길목이라 해봐야... 그렇기에 <b>나</b> 자신이 얼마나 편취당하는지, 혹은 일방적으로 얻어내고 있는지 모르고 오히려 기생체를 두둔하고... ","Thu, 03 Apr 2025 17:54:00 +0900"
11,'조작'의 유권해석,https://www.inews365.com/news/article.html?no=859485,https://www.inews365.com/news/article.html?no=859485,'조작'에 대한 이번 유권 해석은 확실히 과대한 면이 있는 것이다. 혹시 향후의 재판에서 예상치 못한 <b>나비</b>효과가 있지는 않을지 걱정된다. 한국교통대 중국어전공교수 박영록,"Thu, 03 Apr 2025 14:16:00 +0900"
12,&quot;정치 불안해도 경제 지켜야&quot; 故최종현 ‘선경실록’의 울림,http://www.fnnews.com/news/202504021826093934,https://n.news.naver.com/mnews/article/014/0005330481?sid=101,"최태원 회장과 노소영 아트센터 <b>나비</b> 관장 간 이혼소송에서 불거진 유공(현 SK이노베이션), 한국이동통신(SK텔레콤)인수 특혜시비 등과 관련된 세간의 시선을 불식시킬만한 정황적 증거가 대거 포함돼 있는 것으로... ","Wed, 02 Apr 2025 18:27:00 +0900"
13,"인천광역시교육청부평도서관, 영유아 및 초등 1, 2학년 대상 '북스타트...",http://www.beyondpost.co.kr/view.php?ud=202504021238344701edd30pn2gj_30,http://www.beyondpost.co.kr/view.php?ud=202504021238344701edd30pn2gj_30,"‘햇살이와 <b>나비</b>’, 2단계(19~35개월) ‘타세요, 타!’, ‘<b>나는</b> 컵이 아니야!’, 3단계(36개월~취학전) ‘감자 감자 뿅’, ‘어떻게 추는 거야?’, 4단계(초등1~2학년) ‘어느 <b>날</b>’, ‘김밥의 탄생’으로 구성되어 있다.... ","Wed, 02 Apr 2025 16:56:00 +0900"
14,“계엄 뀐 놈이 성내는 꼴 언제까지” 집필노동자 243명도 한줄 선언,https://www.hani.co.kr/arti/culture/book/1190254.html,https://n.news.naver.com/mnews/article/028/0002738839?sid=103,소설가 박해울 벌들이 더 좋아하는 꽃이 하나 있어 <b>나비</b>들도 원해 그 보라색 민주주의자를 얻으려 해 벌새도 열망해 - 에밀리 디킨슨 윤석열의 탄핵 인용과 파면 그리고 민주주의의 회복을 이 봄이 원합니다. 번역가 박혜란... ,"Wed, 02 Apr 2025 16:36:00 +0900"
15,"&quot;정치불안에도, 사명감 갖고 경제 지켜야&quot; 故최종현 '선경실록' 복원",http://www.fnnews.com/news/202504021509539767,https://n.news.naver.com/mnews/article/014/0005330302?sid=101,"최태원 회장과 노소영 아트센터 <b>나비</b> 관장 간 이혼소송에서 불거진 유공(현 SK이노베이션), 한국이동통신(SK텔레콤)인수 특혜시비 등과 관련된 세간의 시선을 불식시킬만한 정황적 증거가 대거 포함돼 있는 것으로... ","Wed, 02 Apr 2025 15:26:00 +0900"
16,"부평도서관, 영유아 및 초등 1·2학년 '북스타트 책꾸러미' 배부",http://www.shinailbo.co.kr/news/articleView.html?idxno=2031086,http://www.shinailbo.co.kr/news/articleView.html?idxno=2031086,"‘햇살이와 <b>나비</b>’, 2단계(19~35개월) ‘타세요, 타!’, ‘<b>나는</b> 컵이 아니야!’, 3단계(36개월~취학전) ‘감자 감자 뿅’, ‘어떻게 추는 거야?’, 4단계(초등1~2학년) ‘어느 <b>날</b>’, ‘김밥의 탄생’으로 구성되어 있다.... ","Wed, 02 Apr 2025 14:02:00 +0900"
17,"인천광역시교육청부평도서관, 영유아 및 초등 1·2학년 대상 '북스타트...",http://www.m-i.kr/news/articleView.html?idxno=1224042,http://www.m-i.kr/news/articleView.html?idxno=1224042,"선정도서는 1단계(0~8개월) '동글동글 동그라미', '햇살이와 <b>나비</b>', 2단계(19~35개월) '타세요, 타!', '<b>나는</b> 컵이 아니야!', 3단계(36개월~취학전) '감자 감자 뿅', '어떻게 추는 거야?', 4단계(초등1~2학년) '어느 <b>날</b>', '김밥의 탄생... ","Wed, 02 Apr 2025 13:00:00 +0900"
18,"[원더풀 파나마] 숲의 철학자, 가장 느린 포유류 '나무늘보'",http://www.opinionnews.co.kr/news/articleView.html?idxno=114942,http://www.opinionnews.co.kr/news/articleView.html?idxno=114942,비단같기도 하고 이집트에서 만난 딱정벌레의 반짝이는 색같기도한 이 녀석은 모르포(morpho)<b>나비</b>다. 세상에서 가장 아름다운 <b>나비</b>라고 불리우기도 한다. 이 <b>나비</b>를 만나면 행운이 깃든다는 말이 있어 우리는 <b>나비</b>를... ,"Wed, 02 Apr 2025 11:30:00 +0900"
19,"김천교육지원청, 사랑 솔솔 촉감 놀이 가족 사랑 도예 체험 실시",http://www.beyondpost.co.kr/view.php?ud=202504011910188451edd30pn2gj_30,http://www.beyondpost.co.kr/view.php?ud=202504011910188451edd30pn2gj_30,"봄을 맞이하여 <b>나비</b>, 벌, 무당벌레, 개구리 도안도 있었고 유아들이 좋아하는 하트모양, 딸기, 토끼 도안도 있었다. 유아들은 자신이 좋아하는 모양을 선택하여 동그란 진흙판 위에 각자 자신이 원하는 색과 모양으로... ","Wed, 02 Apr 2025 10:22:00 +0900"
20,"문향만리)꽃 따러 갔다가, 꽃 따라 가버렸지요 / 김청수",https://www.idaegu.com/news/articleView.html?idxno=633338,https://www.idaegu.com/news/articleView.html?idxno=633338,"하느적 <b>나비</b>되어 날아가 버렸지요// 병원 침대에 누워서 / 눈에 밟히는 어린 새끼들 남기고/ 그 새벽 어둠에... 능선 따라 뿌연 북서쪽으로 가야산과 미숭산의 노을이 좋다며, 언제 쾌청한 <b>날</b> 다시 함께 오자고 하였다. 산... ","Wed, 02 Apr 2025 09:46:00 +0900"
21,[경계선에 서서] 내게는 없고 그녀에게는 있다,https://www.newsclaim.co.kr/news/articleView.html?idxno=3042542,https://www.newsclaim.co.kr/news/articleView.html?idxno=3042542,"지금과 달리, 그때는 나에게도 거칠지만 <b>날</b> 것에 대한 애정, 꿈에 대한 열정이 오롯이 살아있었다. &quot;언제 한번... 그 허황된 광경에 잠시 넋을 잃은 <b>나는</b> 순간적으로 화초 위를 춤추고 있는 <b>나비</b>를 그리고 있었다. 그런 나를... ","Wed, 02 Apr 2025 09:32:00 +0900"
22,[이응준의 과거에서 보내는 엽서] [8] 포클랜드섬 침공,https://www.chosun.com/opinion/specialist_column/2025/04/02/O4LRWQP2SZEXVCPSQIX3MPPLLA/?utm_source=naver&utm_medium=referral&utm_campaign=naver-news,https://n.news.naver.com/mnews/article/023/0003896986?sid=103,"연쇄반응, ‘<b>나비</b>효과’를 시사한다. 또한 대처의 성공은 레이건의 성공과 맞물려 돌아가 소련을... ‘역사의 <b>나비</b>효과’에는 특히 독재국가들이 취약하다. 우크라이나에 파병한 북한의 미래도 예외가 아니다. 매일... ","Wed, 02 Apr 2025 00:18:00 +0900"
23,살랑이는 봄바람⋯춘천에 퍼지는 생강나무꽃 향기,https://www.mstoday.co.kr/news/articleView.html?idxno=97455,https://www.mstoday.co.kr/news/articleView.html?idxno=97455,(사진=)알싸한 향기가 퍼지는 생강나무꽃에 네발<b>나비</b> 한 마리가 앉아 있다. (사진=)김유정의 소설 '동백꽃'에서 말한 '알싸하고 향긋한 냄새나는 노란 동백꽃'은 생강나무꽃을 말한다. (사진=)춘천 김유정문학촌을 찾은... ,"Wed, 02 Apr 2025 00:06:00 +0900"
24,"<b>나비</b>, 신곡 '별짓 다 해봐도' 독보적 감성 예고",https://www.hankyung.com/article/202504014200H,https://m.entertain.naver.com/article/015/0005113763,"공개된 영상에서는 호소력 짙은 <b>나비</b>의 보컬과 함께 &quot;너를 지우려고 미친 듯이 <b>나</b> 별짓 다 해봤는데, 정말 결국엔 또다시 <b>나는</b> 네가 보고 싶다&quot;로 흘러가는 애절한 노랫말이 더해져 이별의 감정을 고스란히 전달했다. <b>나비</b>... ","Tue, 01 Apr 2025 22:14:00 +0900"
25,보이스퀸 히든싱어 가수 안이숙 '원앙금침' 신곡 발표,http://www.gndomin.com/news/articleView.html?idxno=428956,http://www.gndomin.com/news/articleView.html?idxno=428956,봐도 봐도 내 사랑아/어화 둥둥 내 사랑아/ 내님이 <b>나는</b> 좋소/ 오늘같은 좋은 날에/ 내 님이랑 손잡고/ 훨훨 날아보세/ 두둥실 두둥실 사랑 장단에/ 허리춤에 사랑싣고/ 님이랑 둘이서/ 꽃<b>나비</b>되어 사랑꽃잎 뚝뚝... ,"Tue, 01 Apr 2025 17:45:00 +0900"
26,"가수 <b>나비</b>, 신곡 ‘별짓 다 해봐도’ 하이라이트 프리뷰 영상 공개",https://sports.khan.co.kr/article/202504011728003?pt=nv,https://m.entertain.naver.com/article/144/0001029520,"영상에서는 호소력 짙은 <b>나비</b>의 보컬과 함께 “너를 지우려고 미친 듯이 <b>나</b> 별짓 다 해봤는데, 정말 결국엔 또다시 <b>나는</b> 네가 보고 싶다”로 흘러가는 애절한 노랫말이 더해져 이별의 감정을 고스란히 전달했다. <b>나비</b>... ","Tue, 01 Apr 2025 17:29:00 +0900"
27,"<b>나비</b>, 신곡 '별짓 다 해봐도' 하이라이트 공개…애절한 감성",https://www.news1.kr/entertain/music/5738922,https://m.entertain.naver.com/article/421/0008166308,"공개된 영상에서는 호소력 짙은 <b>나비</b>의 보컬과 함께 '너를 지우려고 미친 듯이 <b>나</b> 별짓 다 해봤는데, 정말 결국엔 또다시 <b>나는</b> 네가 보고 싶다'로 흘러가는 애절한 노랫말이 더해져 이별의 감정을 고스란히 전달했다. <b>나비</b>... ","Tue, 01 Apr 2025 15:20:00 +0900"
28,"<b>나비</b>, 신곡 ‘별짓 다 해봐도’ 하이라이트 오픈…애절한 감성 보컬 ‘...",https://www.xportsnews.com/article/1980658,https://m.entertain.naver.com/article/311/0001845892,"영상 속 <b>나비</b>는 호소력 짙은 목소리로 “너를 지우려고 미친 듯이 <b>나</b> 별짓 다 해봤는데, 정말 결국엔 또다시 <b>나는</b> 네가 보고 싶다”는 가사를 애절하게 부르며 이별의 감정을 고스란히 전달했다. <b>나비</b> 특유의 감성적인... ","Tue, 01 Apr 2025 15:13:00 +0900"
29,"대전시립연정국악원, 노름마치예술단 '허튼소리'...오는 11일",http://www.dtnews24.com/news/articleView.html?idxno=788401,http://www.dtnews24.com/news/articleView.html?idxno=788401,"이어 ▲연극 극단예도_선녀씨이야기(5월 2일) ▲전통 연희공방음마갱깽_꼭두, 80일간의 세계일주(5월 3일)) ▲무용 주식회사아트로버컴퍼니_녕(寧 ), 왕자의 길(6월 7일.) ▲뮤지컬 주식회사 섬으로 간 <b>나비</b>_민들레 피리... ","Tue, 01 Apr 2025 14:12:00 +0900"
30,[과학산책] 잊혀진 밀레니엄 수학난제 ‘일기예보’,https://www.naeil.com/news/read/543075?ref=naver,https://www.naeil.com/news/read/543075?ref=naver,하늘을 <b>날</b> 수 있을까? 유체역학은 어렵다. 배면 비행하는 전투기. 출처: 공군 블랙이글스 일기예보는 다양한 생물리화학 과정과 함께 공기의 움직임을 다루는 유체역학이 기본이다. <b>나비</b>에-스톡스 방정식을 풀어야한다.... ,"Tue, 01 Apr 2025 13:04:00 +0900"
31,"<b>나비</b>, ‘별짓 다 해봐도’ 애절한 보이스→음원 일부 공개",https://sports.donga.com/ent/article/all/20250401/131324111/1,https://m.entertain.naver.com/article/382/0001187651,"공개된 영상에서는 호소력 짙은 <b>나비</b>의 보컬과 함께 “너를 지우려고 미친 듯이 <b>나</b> 별짓 다 해봤는데, 정말 결국엔 또다시 <b>나는</b> 네가 보고 싶다”로 흘러가는 애절한 노랫말이 더해져 이별의 감정을 고스란히 전달했다.... ","Tue, 01 Apr 2025 10:04:00 +0900"
32,‘노랑<b>나비</b> 훨훨 날아서 그곳에 나래접누나’… 봄은 오지 말래도 온다...,https://www.munhwa.com/news/view.html?no=2025040101032212000001,https://m.entertain.naver.com/article/021/0002700031,‘<b>나</b> 홀로 걸어가는 안개만이 자욱한 이 거리’ 그런데 안개 속을 걷는 사람이 <b>나</b> 혼자가 아니었다. 안개가 걷히니 여기저기서 ‘지나간 추억 그래도 애타게 그리는 마음’(‘안개’ 1절)을 여실히 드러낸다. ‘안개 속에... ,"Tue, 01 Apr 2025 09:24:00 +0900"
33,"<b>나비</b>, 독보적 감성 예고한 신곡 하이라이트 프리뷰 영상",https://www.newsen.com/news_view.php?uid=202504010718112410,https://m.entertain.naver.com/article/609/0000970202,"공개된 영상에서는 호소력 짙은 <b>나비</b>의 보컬과 함께“너를 지우려고 미친 듯이 <b>나</b> 별짓 다 해봤는데, 정말 결국엔 또다시 <b>나는</b> 네가 보고 싶다”로 흘러가는 애절한 노랫말이 더해져 이별의 감정을 고스란히 전달했다.... ","Tue, 01 Apr 2025 07:20:00 +0900"
34,한국시각장애인연합회 제작 화면해설방송 주간 편성안내(3월31일~4월6일...,https://www.beminor.com/news/articleView.html?idxno=27706,https://www.beminor.com/news/articleView.html?idxno=27706,07시00분~07시30분 <b>나비</b>의 모험 2회 03월 31일 월요일  OBS 08시40분~09시30분 극한직업 - 과테말라... 국가부도의 <b>날</b> 03월 31일 월요일  tvN SHOW 14시15분~16시05분 신서유기7 3회 03월 31일 월요일... ,"Tue, 01 Apr 2025 01:30:00 +0900"
35,한국시각장애인연합회 제작 화면해설방송 주간 편성안내(3월24일~3월30일...,https://www.beminor.com/news/articleView.html?idxno=27705,https://www.beminor.com/news/articleView.html?idxno=27705,좋은 <b>날</b> 03월 24일 월요일  tvN DRAMA 16101725 16시10분~17시25분 그놈은 흑염룡 9회 03월 24일... 07시00분~07시30분 <b>나비</b>의 모험 1회 03월 25일 화요일  tvN DRAMA 09251055 09시25분~10시55분 갯마을... ,"Tue, 01 Apr 2025 01:30:00 +0900"
36,대전시립연정국악원 문체부 공모사업 첫 작품 '허튼소리' 4월 11일 개막,https://www.joongdo.co.kr/web/view.php?key=20250331010009809,https://www.joongdo.co.kr/web/view.php?key=20250331010009809,31일에는 '섬으로간<b>나비</b>'의 뮤지컬 '민들레 피리' 등 다양한 장르의 공연이 준비돼 있다. 첫 공연을 펼칠 (사)노름마치예술단은 1993년 창단 이후 전통음악의 틀을 유지하면서도 현대 관객들과 소통할 수 있는 무대를... ,"Mon, 31 Mar 2025 16:50:00 +0900"
37,"대전시립연정국악원, 전국 순회 공연 유치…우수 공연 5편 연중 선보인...",https://www.pressian.com/pages/articles/2025032912442003835?utm_source=naver&utm_medium=search,https://n.news.naver.com/mnews/article/002/0002380848?sid=102,"이어서 극단예도 '선녀씨이야기' 5월2일, 연희공방음마갱깽 꼭두 '80일간의 세계일주' 5월3일, 주식회사아트로버컴퍼니 녕(寧 ) '왕자의 길이' 6월7일, 뮤지컬 주식회사 섬으로 간 <b>나비</b> '민들레 피리' 10월31일 등 총 5편의... ","Mon, 31 Mar 2025 14:30:00 +0900"
38,[부산 전시] 이번 주에 뭐 볼까? [2025년 3월 31일~ ],https://www.busan.com/view/busan/view.php?code=2025033000503398034,https://n.news.naver.com/mnews/article/082/0001318721?sid=103,연상시켜 <b>나비</b>효과를 유도하고자 한다. ▶4월 1일(화)~30일(수) 부산 해운대구 로터스 갤러리(해운대로... ◆2024 부산모카 플랫폼_미안해요 데이브 유감이지만 <b>난</b> 그럴 수 없어요 [부산현대미술관] 부산현대미술관이... ,"Mon, 31 Mar 2025 13:43:00 +0900"
39,한시련 제작 화면해설방송 주간 편성안내(3월31일~4월6일),https://www.ablenews.co.kr/news/articleView.html?idxno=220000,https://www.ablenews.co.kr/news/articleView.html?idxno=220000,07시00분~07시30분 <b>나비</b>의 모험 2회 03월 31일 월요일  OBS 08시40분~09시30분 극한직업 - 과테말라... 국가부도의 <b>날</b> 03월 31일 월요일  tvN SHOW 14시15분~16시05분 신서유기7 3회 03월 31일 월요일... ,"Mon, 31 Mar 2025 11:04:00 +0900"
40,'장애인에게도 활짝' 스마트농업 일자리 가능성 확인,http://www.kado.net/news/articleView.html?idxno=1302041,https://n.news.naver.com/mnews/article/654/0000113527?sid=102,발달장애인을 지원하는 사회적 기업 <b>나비</b>소셜컴퍼니 소속 교육생 6명이 최근 춘천 지암리의 초록달코미네... 김윤정 <b>나비</b>소셜컴퍼니 소장은 수업을 마친 이들에게 소감을 물었다. 앞장서서 상추 수확에 나섰던 상선 씨는... ,"Mon, 31 Mar 2025 00:08:00 +0900"
41,[엄상익의 시선] '천재성'은 '고독' 속에서 쑥쑥 자라난다,http://kor.theasian.asia/archives/379546,http://kor.theasian.asia/archives/379546,몇 <b>날</b> 며칠을 사람을 만나지 않고 혼자 살아가는 족속이지.”자기가 몰입하는 일에 빠지다 보면 사람을... 벌은 여러 마리가 함께 하지만 <b>나비</b>는 혼자 날아다닌다. 사람도 혼자 살아가는 족속이 있는 것 같다.내 경우는... ,"Sun, 30 Mar 2025 09:42:00 +0900"
42,"내란성 불면, 저는 이거 한잔 마셨습니다 [윤한샘의 맥주실록]",https://www.ohmynews.com/NWS_Web/View/at_pg.aspx?CNTN_CD=A0003113860&CMPT_CD=P0010&utm_source=naver&utm_medium=newsearch&utm_campaign=naver_news,https://n.news.naver.com/mnews/article/047/0002467691?sid=103,세상을 향해 활짝 벌린 손 위에는 <b>나비</b>가 보인다. <b>나는</b> 출퇴근하며 매일 소녀상에게 인사한다. 가끔 우직한 그 모습에 위안을 얻는다. '작은 소녀상'은 어두운 바이젠복이다. 미묘한 건자두와 블랙베리 향이 난다. 7.9... ,"Sat, 29 Mar 2025 11:13:00 +0900"
43,"대전연정국악원, 문체부 공모사업 선정작 첫 무대 올린다",http://www.bzeronews.com/news/articleView.html?idxno=704737,http://www.bzeronews.com/news/articleView.html?idxno=704737,7.) ▲뮤지컬 주식회사 섬으로 간 <b>나비</b>_민들레 피리(10. 31.)까지 총 5편의 우수 공연이 대전시민과 만난다. (사)노름마치예술단은 1993년 창단 이래 전통음악의 틀을 유지하면서도 동시대 관객들이 공감할 수 있는... ,"Sat, 29 Mar 2025 09:00:00 +0900"
44,&quot;찬송가는 나의 뿌리&quot;…노래로 '그 나라' 꿈꾸다,https://www.goodnews1.com/news/articleView.html?idxno=445814,https://www.goodnews1.com/news/articleView.html?idxno=445814,▲찬양 사역자 김도현이 서울 서초구 <b>나비</b>공장에서 본지와 인터뷰 하고 있다.ⓒ데일리굿뉴스  이 땅과... 안 그러던 형들이 어느 <b>날</b> 갑자기 신앙생활을 열심히 하니까 신기했어요. 그래서 저도 형들의 변화가 있었던... ,"Fri, 28 Mar 2025 19:38:00 +0900"
45,[특파원 시선] 美와 유럽 사이…英스타머 줄타기는 계속된다,https://www.yna.co.kr/view/AKR20250328003400085?input=1195m,https://n.news.naver.com/mnews/article/001/0015294955?sid=104,이때쯤 시사주간지 이코노미스트는 중절모와 <b>나비</b>넥타이 차림으로 지팡이를 짚은 스타머 총리의 모습을 표지에 싣고 '윈스턴 스타머'란 글자를 박아넣었다. 윈스턴은 영국의 2차대전 영웅이자 대서양 동맹의 상징적 인물... ,"Fri, 28 Mar 2025 07:07:00 +0900"
46,3월28일 오늘의 운세-띠별-별자리,http://www.namdonews.com/news/articleView.html?idxno=813958,http://www.namdonews.com/news/articleView.html?idxno=813958,원숭이띠 : 꽃을 찾는 <b>나비</b>가 길을 잃은 격이니 주위를 잘 살펴보라. 80년생 : 벼슬에 임하는 운이니 좋은... 탄생별자리는 자신이 태어난 <b>날</b> 태양의 위치를 말합니다.그리고 별자리에는 24절기중 2개의 절기를 포함하고... ,"Fri, 28 Mar 2025 00:00:00 +0900"
